{"manifest_version":"1","status":"in_progress","company_list_sha256":"c6aa65de04ec7612d34178afa19f28d727e3536708fa963f3fa174ae2435dead","total_companies":2000,"total_batches":80,"batches":[{"batch_id":"domestic-01","scope":"domestic","batch_number":1,"status":"pending","company_list_sha256":"1a49ea01657eec282f186642027d08266c53a9127abfc33f09f5babab58984b6","claim_count":0,"no_claim_count":0},{"batch_id":"domestic-02","scope":"domestic","batch_number":2,"status":"pending","company_list_sha256":"1a32d67593eafacad1fed0a3a11ba9fe3f0f70e9035b6ef7e6499222bac0e6d6","claim_count":0,"no_claim_count":0},{"batch_id":"domestic-03","scope":"domestic","batch_number":3,"status":"pending","company_list_sha256":"9b9b0ecc698881155a493eab88a7358a834f8535c399afb5491f8450236d85d6","claim_count":0,"no_claim_count":0},{"batch_id":"domestic-04","scope":"domestic","batch_number":4,"status":"pending","company_list_sha256":"f263590b1c4a334919120e6b69968fd0974fd9f91d88d3f11f719068359be473","claim_count":0,"no_claim_count":0},{"batch_id":"domestic-05","scope":"domestic","batch_number":5,"status":"pending","company_list_sha256":"f8d4b8a8f4b927e59eb07118cfe81b7e5c707879c6ca644a89b2e2228276c6a4","claim_count":0,"no_claim_count":0},{"batch_id":"domestic-06","scope":"domestic","batch_number":6,"status":"pending","company_list_sha256":"ad03b9e6810d1efaa6c82afac611faa6cc3945d28c89f5e80f039a9c20e4d444","claim_count":0,"no_claim_count":0},{"batch_id":"domestic-07","scope":"domestic","batch_number":7,"status":"pending","company_list_sha256":"bbc7368c82fa78b7ef3368cab3643111b9a033b7968a479c003639febc1420b0","claim_count":0,"no_claim_count":0},{"batch_id":"domestic-08","scope":"domestic","batch_number":8,"status":"pending","company_list_sha256":"409c3fda2abc59760d1f0c86a73caceabc726d08511f491e8c22c17dacd72d14","claim_count":0,"no_claim_count":0},{"batch_id":"domestic-09","scope":"domestic","batch_number":9,"status":"pending","company_list_sha256":"d461cba9ce12b654c0a259af6b7d44fb941cc1c02c1c15a939973822815cbb95","claim_count":0,"no_claim_count":0},{"batch_id":"domestic-10","scope":"domestic","batch_number":10,"status":"pending","company_list_sha256":"627b8970754dc35cf28d92567b00f35a25e55be798fb5cc684149101583f0719","claim_count":0,"no_claim_count":0},{"batch_id":"domestic-11","scope":"domestic","batch_number":11,"status":"pending","company_list_sha256":"5b1250bbaca0ef0d5ab1e27515c311e8aa927420fabd0236dcebd13499a12561","claim_count":0,"no_claim_count":0},{"batch_id":"domestic-12","scope":"domestic","batch_number":12,"status":"pending","company_list_sha256":"10adb0c92a227d813882adf6a592e80b8ed75fd0b9ec5ddab104845ba992d9d7","claim_count":0,"no_claim_count":0},{"batch_id":"domestic-13","scope":"domestic","batch_number":13,"status":"pending","company_list_sha256":"6aa027f89e099142113748c5ede28ae204d53feb3573ba451689cf73c2148039","claim_count":0,"no_claim_count":0},{"batch_id":"domestic-14","scope":"domestic","batch_number":14,"status":"pending","company_list_sha256":"bb4d752ac025ff258b7e3abfb3f418811485a258020abb3d666a8e0fc677366b","claim_count":0,"no_claim_count":0},{"batch_id":"domestic-15","scope":"domestic","batch_number":15,"status":"pending","company_list_sha256":"144afb4fa3a4f7938c25ac7a5fd9c71d8f4a028cd634c01ec019a987f3227da4","claim_count":0,"no_claim_count":0},{"batch_id":"domestic-16","scope":"domestic","batch_number":16,"status":"pending","company_list_sha256":"ca87d99c67dcf6ff986988534320fbbdb0d3a3ba146d21ff48dee8a9b5941fa0","claim_count":0,"no_claim_count":0},{"batch_id":"domestic-17","scope":"domestic","batch_number":17,"status":"pending","company_list_sha256":"2dab668701c0b98f113e10018157dabc620701493140a93bf757a77765e50bab","claim_count":0,"no_claim_count":0},{"batch_id":"domestic-18","scope":"domestic","batch_number":18,"status":"pending","company_list_sha256":"effd701b5fe5339447806c55d344680f48d87a5699ace89daeb822d682926e69","claim_count":0,"no_claim_count":0},{"batch_id":"domestic-19","scope":"domestic","batch_number":19,"status":"pending","company_list_sha256":"830edf2adbf0d3ec9260411c4f5ca6329bfc54821c6fb92e1001a4c19834d65e","claim_count":0,"no_claim_count":0},{"batch_id":"domestic-20","scope":"domestic","batch_number":20,"status":"pending","company_list_sha256":"a988c0d42234506c9de82695fa9a9172994c0285dcb68a778fed7bfdbee480bf","claim_count":0,"no_claim_count":0},{"batch_id":"domestic-21","scope":"domestic","batch_number":21,"status":"pending","company_list_sha256":"ec9c861464ef2f17f9f9761039e04c67dd1a5725ea7b96f933db8200ecfecbfd","claim_count":0,"no_claim_count":0},{"batch_id":"domestic-22","scope":"domestic","batch_number":22,"status":"pending","company_list_sha256":"e608ef923b11037156d6800e59066403dc01715d728b432172c3cde6c1adc0a1","claim_count":0,"no_claim_count":0},{"batch_id":"domestic-23","scope":"domestic","batch_number":23,"status":"pending","company_list_sha256":"45afd48cc2715e21a6a6a6eb98ffa75cf96d5c351ab3674c1eafcc6cd109ced0","claim_count":0,"no_claim_count":0},{"batch_id":"domestic-24","scope":"domestic","batch_number":24,"status":"pending","company_list_sha256":"0506443a0b19a0f385baba498bc6a8563bb740f6323c9935cbff31da6d8a97f5","claim_count":0,"no_claim_count":0},{"batch_id":"domestic-25","scope":"domestic","batch_number":25,"status":"pending","company_list_sha256":"24bebd377c50be31144dcd9e47f98930682488c5c5ef1d74db71112c5635f3e2","claim_count":0,"no_claim_count":0},{"batch_id":"domestic-26","scope":"domestic","batch_number":26,"status":"pending","company_list_sha256":"80ad98cfddf55e0bb0d5b0550f3dff1387f2d2cee816e7c2fb0f3501520d65ea","claim_count":0,"no_claim_count":0},{"batch_id":"domestic-27","scope":"domestic","batch_number":27,"status":"pending","company_list_sha256":"7ddfaf264bf3d46a04f9c2e08aac8a81260a62ad61bac609704f2f9f76950b35","claim_count":0,"no_claim_count":0},{"batch_id":"domestic-28","scope":"domestic","batch_number":28,"status":"pending","company_list_sha256":"a1ed7b179ebcaf3d69c933a1c88747f13328bb0aff7aced0d4e97b690b2343ea","claim_count":0,"no_claim_count":0},{"batch_id":"domestic-29","scope":"domestic","batch_number":29,"status":"pending","company_list_sha256":"65440646a9ee96a0ca4582a098d4d88ff352bc39bf27bda760ac6ff1f564dcae","claim_count":0,"no_claim_count":0},{"batch_id":"domestic-30","scope":"domestic","batch_number":30,"status":"pending","company_list_sha256":"360cfce5569004242c680a95fb75a5f3e111232f3ce3f0e00ea922065c385080","claim_count":0,"no_claim_count":0},{"batch_id":"domestic-31","scope":"domestic","batch_number":31,"status":"pending","company_list_sha256":"05ae4c3c291a99b05ff56b24f251fe2b9359423b353adfd3b116ab2757fd0e08","claim_count":0,"no_claim_count":0},{"batch_id":"domestic-32","scope":"domestic","batch_number":32,"status":"pending","company_list_sha256":"9eeebd7bbebf4cce9d6a5fb55634039e7139d74306aaa31b73badbe93ed50b93","claim_count":0,"no_claim_count":0},{"batch_id":"domestic-33","scope":"domestic","batch_number":33,"status":"pending","company_list_sha256":"155c6a4b44782f6fd681659ca2273d86147e1a9ffab9c7fea38a777a3cf95c41","claim_count":0,"no_claim_count":0},{"batch_id":"domestic-34","scope":"domestic","batch_number":34,"status":"pending","company_list_sha256":"f791cb528e2e0b56b7c4ce3329546ea751428cde29e96ce12c8830b60d45a983","claim_count":0,"no_claim_count":0},{"batch_id":"domestic-35","scope":"domestic","batch_number":35,"status":"pending","company_list_sha256":"c0cb9b51d1d05e4e3d94f5c10f10749819a430acd947742853309247fb240f8c","claim_count":0,"no_claim_count":0},{"batch_id":"domestic-36","scope":"domestic","batch_number":36,"status":"pending","company_list_sha256":"2e2643e9ffd314f00f68b2d6b14df1c2ac43371d246d4b03792d2f6cc4d77092","claim_count":0,"no_claim_count":0},{"batch_id":"domestic-37","scope":"domestic","batch_number":37,"status":"pending","company_list_sha256":"3d8c562f4da5458c2e246b0b4695cf498d33ce8f9cdfa688f3fea35b393df8ba","claim_count":0,"no_claim_count":0},{"batch_id":"domestic-38","scope":"domestic","batch_number":38,"status":"pending","company_list_sha256":"b73febae9b4fb60545a23084e3aaec6d253a98a1f23eb215507a1467edf4d8da","claim_count":0,"no_claim_count":0},{"batch_id":"domestic-39","scope":"domestic","batch_number":39,"status":"pending","company_list_sha256":"a6503a8cd24dcb87dfacbabadbfbd6532410793997fb3e7c8b31bdacae52cbeb","claim_count":0,"no_claim_count":0},{"batch_id":"domestic-40","scope":"domestic","batch_number":40,"status":"pending","company_list_sha256":"1c568cd7fdeb45af0ab2f8dde1274616107e0ad776724e64c844f26994e48f1a","claim_count":0,"no_claim_count":0},{"batch_id":"international-01","scope":"international","batch_number":1,"status":"pending","company_list_sha256":"bc7e0c20ae2a0f7f6404e6011eac8e7f5e402321649f72aae5ac209c988fd120","claim_count":0,"no_claim_count":0},{"batch_id":"international-02","scope":"international","batch_number":2,"status":"pending","company_list_sha256":"33db1a744607d71108e3948b838ea933c9e5ff4b5a5dff191728d7e9a8502bb2","claim_count":0,"no_claim_count":0},{"batch_id":"international-03","scope":"international","batch_number":3,"status":"pending","company_list_sha256":"48524d9e93abebd72e6807b5f696af8249431c5fe5328f4b2c2d0a6c26089d27","claim_count":0,"no_claim_count":0},{"batch_id":"international-04","scope":"international","batch_number":4,"status":"pending","company_list_sha256":"f69757654c1663d333c1cca9471dc41c2bc06cbc1352eb0766387434b18d1218","claim_count":0,"no_claim_count":0},{"batch_id":"international-05","scope":"international","batch_number":5,"status":"pending","company_list_sha256":"ca52b31c31b969dfad2d284f19f9c42de3e1c101a854b2a6a90843af31fe9f1c","claim_count":0,"no_claim_count":0},{"batch_id":"international-06","scope":"international","batch_number":6,"status":"pending","company_list_sha256":"0906771c28e809910c7b529ec786d388c0ac11a3540fe2db6180ae132d97e5d4","claim_count":0,"no_claim_count":0},{"batch_id":"international-07","scope":"international","batch_number":7,"status":"pending","company_list_sha256":"a51e0826286ddbcb00bdbaca9beebdcf89f616bab97f779d82164c7202aa41b7","claim_count":0,"no_claim_count":0},{"batch_id":"international-0